{"schema_version":"profile/v1","os_instance_id":"11111111-1111-4111-8111-111111111111","revision":1,"identity":{"name":"Proyecto Horizonte","language":"es","principles":["La IA propone; el humano decide"],"taboos":["publicar secretos"]},"governance":{"human_in_the_loop":true,"approval_required":["external_write","destructive_action"]},"routing":{"primary":"lab","human_escalation":true},"capabilities":["memory.engram","graph.graphify"]}
